{
  "schemaVersion": "portfolio-snapshot.v1",
  "source": {
    "id": "saxo-bank",
    "provider": "Saxo Bank",
    "exporter": "gcp-portfolio-exporter"
  },
  "generatedAt": "2026-07-06T03:00:00Z",
  "dataAsOf": "2026-07-06T02:59:30Z",
  "baseCurrency": "JPY",
  "accounts": [
    {
      "sourceAccountId": "saxo-account-001",
      "name": "Saxo Main Account",
      "accountType": "margin",
      "baseCurrency": "JPY",
      "sourceMetadata": {
        "accountKey": "masked-account-key"
      }
    }
  ],
  "cashBalances": [
    {
      "sourceAccountId": "saxo-account-001",
      "currency": "JPY",
      "amount": "125000.000000000000000000",
      "valueJpy": "125000.000000000000000000",
      "fxRateToJpy": "1.000000000000000000",
      "sourceBalanceId": "saxo-account-001:JPY"
    },
    {
      "sourceAccountId": "saxo-account-001",
      "currency": "USD",
      "amount": "250.120000000000000000",
      "valueJpy": "39268.840000000000000000",
      "fxRateToJpy": "156.999000000000000000",
      "sourceBalanceId": "saxo-account-001:USD"
    }
  ],
  "positions": [
    {
      "sourceAccountId": "saxo-account-001",
      "sourcePositionId": "position-7203",
      "sourceInstrumentId": "uic-123456",
      "assetClass": "stock",
      "symbol": "7203.T",
      "name": "Toyota Motor Corp.",
      "quantity": "100.000000000000000000",
      "side": "long",
      "price": "3300.000000000000000000",
      "priceCurrency": "JPY",
      "valueJpy": "330000.000000000000000000",
      "costBasisJpy": "300000.000000000000000000",
      "unrealizedPnlJpy": "30000.000000000000000000",
      "sourceMetadata": {
        "exchangeId": "XTKS"
      }
    },
    {
      "sourceAccountId": "saxo-account-001",
      "sourcePositionId": "position-us-etf",
      "sourceInstrumentId": "uic-789012",
      "assetClass": "etf",
      "symbol": "VOO",
      "name": "Vanguard S&P 500 ETF",
      "quantity": "3.250000000000000000",
      "side": "long",
      "price": "500.120000000000000000",
      "priceCurrency": "USD",
      "valueJpy": "255186.230000000000000000",
      "sourceMetadata": {
        "exchangeId": "ARCX"
      }
    },
    {
      "sourceAccountId": "saxo-account-001",
      "sourcePositionId": "position-cfd-btc",
      "sourceInstrumentId": "uic-345678",
      "assetClass": "cfd",
      "symbol": "BTCJPY",
      "name": "Bitcoin CFD",
      "quantity": "0.100000000000000000",
      "side": "long",
      "price": "9800000.000000000000000000",
      "priceCurrency": "JPY",
      "valueJpy": "980000.000000000000000000",
      "unrealizedPnlJpy": "-15000.000000000000000000"
    }
  ],
  "sourceMetadata": {
    "contractOwner": "equinaut"
  }
}
